{
  "$schema": "http://json-schema.org/draft-07/schema#",
  "$id": "confirmation-request-v3.schema.json",
  "title": "AI Confirmation Request Data — v3",
  "description": "SSE confirmation_request 的 data.confirmation 载荷（ConfirmationRequestData）。v3（§22.17 ④ 影响预览切片 v1.1，docs/impact-preview.spec.md）：新增可选 `revokeClass`——单条模式与 toolName/summary 同级，run 模式逐条 items[].revokeClass，取值 = KB-6 撤销能力四档（none / local_compensate / governed_external / transactional），由 resolveRevokeClass 单源给出、与事后撤销页同源，供审批人在批准前知道「这批动作事后能不能撤回」。v2 增量（`impact` 影响预览）保持不变。其余字段同 v1/v2。v2 → schemas/v2/、v1 → schemas/v1/（均冻结历史）。**$id 用裸名（不带 v3/ 前缀）**：v1 孪生已占用裸名 `confirmation-request.schema.json`，而本 schema 需沿用 v1 的跨文件相对 $ref（authorization / risk-level-ref）——带斜杠的 $id 会把相对引用解析到不存在的 v3/ 下（先例：schemas/v2/confirmation-request.schema.json、schemas/v2/evidence-package.schema.json 均用裸 $id）。来源：src/ai/interfaces/llm-provider.interface.ts（ConfirmationRequestData / ConfirmationRunItem）、src/ai/interfaces/tool.interface.ts（RevokeClass / resolveRevokeClass）。",
  "type": "object",
  "required": ["token"],
  "additionalProperties": false,
  "properties": {
    "token": { "type": "string", "minLength": 8 },
    "toolName": { "type": "string" },
    "summary": { "type": "string" },
    "arguments": { "type": "object" },
    "authorization": { "$ref": "authorization.schema.json" },
    "mode": { "enum": ["immediate", "approval", "run"] },
    "impact": { "$ref": "#/definitions/impact" },
    "revokeClass": { "$ref": "#/definitions/revokeClass" },
    "run": {
      "type": "object",
      "required": ["runId", "riskLevel", "items"],
      "additionalProperties": false,
      "properties": {
        "runId": { "type": "string", "minLength": 1 },
        "riskLevel": { "$ref": "risk-level-ref.schema.json" },
        "items": {
          "type": "array",
          "items": {
            "type": "object",
            "required": ["toolName", "summary", "riskLevel"],
            "additionalProperties": false,
            "properties": {
              "toolName": { "type": "string" },
              "summary": { "type": "string" },
              "riskLevel": { "$ref": "risk-level-ref.schema.json" },
              "revokeClass": { "$ref": "#/definitions/revokeClass" }
            }
          }
        }
      }
    }
  },
  "definitions": {
    "impact": {
      "description": "影响预览（估计值，非承诺）：写动作数与对象类型分组。只统计可解析副作用对象的写动作——无法解析者（review_approval_request / create_module 干跑）本就不产生可撤副作用，不计入。actions 恒等于 targets 各 count 之和。",
      "type": "object",
      "required": ["actions", "targets"],
      "additionalProperties": false,
      "properties": {
        "actions": { "type": "integer", "minimum": 1 },
        "targets": {
          "type": "array",
          "minItems": 1,
          "items": {
            "type": "object",
            "required": ["resultType", "count"],
            "additionalProperties": false,
            "properties": {
              "resultType": { "type": "string", "minLength": 1 },
              "count": { "type": "integer", "minimum": 1 }
            }
          }
        }
      }
    },
    "revokeClass": {
      "description": "KB-6 撤销能力档（单源：src/ai/interfaces/tool.interface.ts resolveRevokeClass，显式声明优先）。none = 不可撤/外部未知（前端不得称「可撤销」）；local_compensate = 本地软删补偿（可经 RG-3 回收站恢复）；governed_external = 受治理外部补偿（撤销后为「已请求补偿/结果未知」，禁显示 revoked）；transactional = 目标暴露可回滚接口（枚举预留）。缺省即省略：老载荷不渲染撤销行，不补默认值。",
      "enum": ["none", "local_compensate", "governed_external", "transactional"]
    }
  }
}
